"Status","Start Time","Stop Time","Duration in ms","Parent Suite","Suite","Sub Suite","Test Class","Test Method","Name","Description"
"passed","Sun Apr 16 18:43:40 GMT 2023","Sun Apr 16 18:44:38 GMT 2023","58086","test","test_automation","TestRepeatedInputFromSource","","","Sorozatos sikeres cikk hozzáadása article_data.tsv fájlból",""
"passed","Sun Apr 16 18:44:40 GMT 2023","Sun Apr 16 18:44:42 GMT 2023","1788","test","test_automation","TestWriteAndDeleteArticle","","","Korábban már regisztrált felhasználói fiókkal új cikk sikeres létrehozása.",""
"passed","Sun Apr 16 18:42:36 GMT 2023","Sun Apr 16 18:42:37 GMT 2023","996","test","test_automation","TestRegistration","","","Új felhasználó fiók sikertelen létrehozása már regisztrált email cím megadásával.",""
"passed","Sun Apr 16 18:45:04 GMT 2023","Sun Apr 16 18:45:16 GMT 2023","12359","test","test_automation","TestListAndSaveData","","","Felhasználó saját cikkjeinek sikeres bejárása",""
"passed","Sun Apr 16 18:42:38 GMT 2023","Sun Apr 16 18:42:48 GMT 2023","10385","test","test_automation","TestPrivacyPolicy","","","Adatkezelési tájékoztató sikeres elfogadása.",""
"passed","Sun Apr 16 18:42:54 GMT 2023","Sun Apr 16 18:42:55 GMT 2023","889","test","test_automation","TestLogin","","","Korábban regisztrált felhasznói fiókkal történő sikertelen bejelentkezés hibás jelszó miatt.",""
"passed","Sun Apr 16 18:42:28 GMT 2023","Sun Apr 16 18:42:29 GMT 2023","874","test","test_automation","TestRegistration","","","Új felhasználó fiók sikertelen létrehozása hiányos email cím megadásával.",""
"passed","Sun Apr 16 18:43:24 GMT 2023","Sun Apr 16 18:43:25 GMT 2023","1126","test","test_automation","TestEditProfile","","","Korábban már regisztrált felhasználói fiók bemutatkozásának sikeres módosítása.",""
"passed","Sun Apr 16 18:45:02 GMT 2023","Sun Apr 16 18:45:02 GMT 2023","701","test","test_automation","TestListAndSaveData","","","Népszerű címkék sikeres listázása címkefelhőből",""
"passed","Sun Apr 16 18:42:26 GMT 2023","Sun Apr 16 18:42:27 GMT 2023","1133","test","test_automation","TestRegistration","","","Új felhasználó fiók sikertelen létrehozása hiányos felhasználónév megadásával.",""
"passed","Sun Apr 16 18:44:47 GMT 2023","Sun Apr 16 18:45:00 GMT 2023","12967","test","test_automation","TestWriteAndDeleteArticle","","","Korábban létrehozott cikk sikeres törlése.",""
"passed","Sun Apr 16 18:42:50 GMT 2023","Sun Apr 16 18:42:51 GMT 2023","782","test","test_automation","TestLogin","","","Korábban regisztrált felhasznói fiókkal történő sikertelen bejelentkezés email cím mező üresen hagyása miatt.",""
"passed","Sun Apr 16 18:43:13 GMT 2023","Sun Apr 16 18:43:14 GMT 2023","1604","test","test_automation","TestEditProfile","","","Korábban regisztrált felhasználó felhasználónevének sikeres megváltoztatatása.",""
"passed","Sun Apr 16 18:43:01 GMT 2023","Sun Apr 16 18:43:03 GMT 2023","2017","test","test_automation","TestEditProfile","","","Korábban regisztrált felhasználó fiók profilképének sikertelen megváltoztatatása profilkép hivatkozásának nem megadása miatt.",""
"passed","Sun Apr 16 18:42:56 GMT 2023","Sun Apr 16 18:42:56 GMT 2023","875","test","test_automation","TestLogin","","","Korábban regisztrált felhasznói fiókkal történő sikeres bejelentkezés.",""
"passed","Sun Apr 16 18:42:58 GMT 2023","Sun Apr 16 18:42:58 GMT 2023","664","test","test_automation","TestLogout","","","Korábban létrehozott felhasználóval történő bejelentkezés után sikeres kijelentkezés végrehajtása.",""
"passed","Sun Apr 16 18:42:32 GMT 2023","Sun Apr 16 18:42:34 GMT 2023","2644","test","test_automation","TestRegistration","","","Új felhasználó fiók sikeres létrehozása megfelelő adatok megadásával.",""
"passed","Sun Apr 16 18:43:30 GMT 2023","Sun Apr 16 18:43:39 GMT 2023","8472","test","test_automation","TestRepeatedInputFromSource","","","Sorozatos sikeres regisztráció user_data.csv fájlból",""
"passed","Sun Apr 16 18:43:17 GMT 2023","Sun Apr 16 18:43:18 GMT 2023","1230","test","test_automation","TestEditProfile","","","Korábban regisztrált felhasználó email címének sikertelen megváltoztatatásaemail cím mező üresen hagyása miatt.",""
"passed","Sun Apr 16 18:43:27 GMT 2023","Sun Apr 16 18:43:29 GMT 2023","2338","test","test_automation","TestEditProfile","","","Korábban regisztrált felhasználói fiók jelszavának sikeres megváltoztatása.",""
"broken","Sun Apr 16 18:45:18 GMT 2023","Sun Apr 16 18:45:20 GMT 2023","2743","test","test_automation","TestListAndSaveData","","","Globális hírfolyam cikk címeinek mentése saved_data.tsv fájlba",""
"passed","Sun Apr 16 18:42:49 GMT 2023","Sun Apr 16 18:42:49 GMT 2023","283","test","test_automation","TestLogin","","","Korábban regisztrált felhasznói fiókkal történő sikertelen bejelentkezés jelszó mező üresen hagyása miatt.",""
"passed","Sun Apr 16 18:43:20 GMT 2023","Sun Apr 16 18:43:21 GMT 2023","809","test","test_automation","TestEditProfile","","","Korábban regisztrált felhasználó email címének sikertelen megváltoztatatása már létező email cím miatt.",""
"passed","Sun Apr 16 18:42:52 GMT 2023","Sun Apr 16 18:42:53 GMT 2023","395","test","test_automation","TestLogin","","","Korábban még nem regisztrált felhasznói fiókkal történő sikertelen bejelentkezés.",""
"passed","Sun Apr 16 18:44:44 GMT 2023","Sun Apr 16 18:44:45 GMT 2023","1467","test","test_automation","TestWriteAndDeleteArticle","","","Korábban már regisztrált felhasználói fiókkal új cikk sikertelen létrehozása cikk címének hiánya miatt.",""
"passed","Sun Apr 16 18:43:05 GMT 2023","Sun Apr 16 18:43:07 GMT 2023","1620","test","test_automation","TestEditProfile","","","Korábban regisztrált felhasználó fiók profilképének sikeres megváltoztatatása.",""
"passed","Sun Apr 16 18:42:30 GMT 2023","Sun Apr 16 18:42:31 GMT 2023","896","test","test_automation","TestRegistration","","","Új felhasználó fiók sikertelen létrehozása hiányos jelszó megadásával.",""
"passed","Sun Apr 16 18:43:09 GMT 2023","Sun Apr 16 18:43:10 GMT 2023","995","test","test_automation","TestEditProfile","","","Korábban regisztrált felhasználó felhasználónevévek sikertelen megváltoztatatása név nem megadása miatt.",""
